sentence,emotion
Mr West predicts that January 1 will mean a free for all.,Joy
"But if we wait long enough, perhaps thousands of years, Tit for Tat will eventually muster the numbers required to tip it over the knife-edge, and the population will flip.",Anticipation
Somehow you have to play devil 's advocate against your presentation and try to knock it to pieces.,Anticipation
Staff tiptoe past your room at night so as to let sleeping dogs lie.,Joy
Black And Blue is BBC1's controversial 90-minute drama guaranteed to get the law and order brigade hot under the collar.,Anticipation
Neither Bradford nor Birmingham regrets entering the tourist trade - the industry waits with bated breath to see how Swindon fares.,Anticipation
It calls for consummate timing and nerves of steel.,Anticipation
She would be suffering from pins and needles.,Anticipation
But the Tigersharks are wide awake and raring to go.,Anticipation
How about that for a Freudian slip?,Surprise
"The following day, however, Mrs Thatcher had a change of heart, and asked him to flesh out his figures.",Anticipation
"Most people in Three Oaks Bay were awaiting Dizzy Liston's return with mixed feelings; mainly apprehension, mixed with trepidation.",Anticipation
And of course we're pleased as Punch to put him in print again.,Joy
Their very names speak volumes for the unity which the Spirit creates.,Joy
"These were wise words from a wise old bird, but Matilda was too steamed up to see it that way.",Joy
"Drama Zoff detailed the drama behind the scenes as Gazza was kept on tenterhooks for the past four days, wondering whether he would make his Italian debut.",Anticipation
"Yo dudes, it's time to chill out with DJ Phil Disco King.",Joy
"The equivalent, I suppose, of someone who loves chocolate falling into a big vat of the stuff and unhurriedly eating their way out. I was in my element, immersing myself in all the terms falconers use and studying Brian's vast collection of equipment, some of it quite old and valuable, but in immaculate condition, like his birds.",Joy
"The morning session at the law courts was in full swing, and the halls and corridors were crowded.",Anticipation
She was having a very enjoyable time and was clearly the life and soul of the party.,Joy
'I was only pulling your leg' his face collapsed with relief.,Surprise
"In 1987, when I was chosen to fight my first election at Birmingham's Perry Barr, I was on cloud nine, even though it was a safe Labour seat.",Joy
Suddenly Lisa was grinning from ear to ear.,Joy
"' Smile,' he said, his voice indicating that he was certainly grinning like a Cheshire cat.",Joy
The sight of a twig she had picked bursting into bud in a vase was enough to send her in raptures.,Joy
Birthday boy Fred Proctor was in seventh heaven after notching up yet another election success.,Joy
"People have been diagnosed with cancer etcetera, erm, in fact at the convention yesterday, they had some clients on the stage, one lady had been diagnosed with breast cancer, she got a pay-out from living assurance, five years later she's been cleared, and, and she's thrilled to bits about it.",Joy
It was a wonderful feeling as if I was walking on air.,Joy
We would soon be in input overload and go nuts.,Anticipation
Every time it goes on the blink I wonder who'll win.,Anticipation
"We were caught, high and dry.",Surprise
"But scratch the surface, and an astonishing mystery is revealed.",Anticipation
This is the tip of the iceberg.,Anticipation
I hope all your plans go forward without a hitch.,Anticipation
"Al Jourgensen is running around backstage, shouting out such helpful commands through his megaphone as' Batten down the hatches', and' Splice the mainsail'; stopping every minute or two to proudly show off his new tattoo.",Anticipation
"Muriel, probably because of her years and the fact they were looking for a more mature person, was by a hair 's breadth the front-runner, ahead of two younger girls both with experience of the insurance business.",Anticipation
I believed he was in safe hands.,Trust
"Anyway, you'd better watch your step.",Anticipation
"She was too tall and untidy, but her quality shone out like a light as she passed into the crowd, and the noise and the tension that are part of even the smallest race meeting.",Surprise
"With so much within easy reach, we were clearly spoilt for choice and decided to sleep on it.",Anticipation
"Both projects, and more besides, aim to make Microsoft an also-ran in tomorrow's markets.",Anticipation
No you've got them in the bag.,Surprise
Over eight hundred people turned out in Oxford to see the blockbuster everyone's talking about.,Anticipation
"Alistar Campbell roared past 500 runs on Saturday and put himself firmly on course for the magical 1,000 mark.",Anticipation
"After all, England have another chance to fall from grace when they meet Germany on Saturday.",Anticipation
"Before the setbacks, the new Lancias had passed their tests with flying colours.",Joy
"Finally, under the obscurity of dust and smoke the Germans managed to get a foothold on the summit",Joy
For months the polls have been predicting an unprecedented landslide victory for the Right in next month's general election.,Anticipation
"Twelve months ago we came on leaps and bounds, and surprised even ourselves by winning the All Ireland.",Surprise
"A 68 put Ballesteros safely through to the last two days but a distressed Olazabal, despite a 69, faced an anxious wait to see if he would make the cut.",Anticipation
It was absolutely make or break.,Anticipation
And so the moment of truth.,Surprise
"He likes to be one step ahead of the pack, getting there before others do.",Anticipation
If he played golf as badly as that he'd pack it in.,Surprise
It may prove to be a Pyrrhic victory.,Anticipation
Then out of the blue he got a phone call asking if he was still interested in the car as it had to be sold to make space for the family.,Surprise
Lisa's jaw dropped open.,Surprise
Words fail me in praise of your company and its workforce.,Joy
"While perhaps reasonable for a very small group, it could soon become a free for all in a larger organisation.",Anticipation
This amounts to a quest for possible ways in which Tit for Tat individuals might happen to cluster together in sufficient numbers that they can all benefit at the banker's expense.,Surprise
She returned with a bravado somewhat at odds with the way she was feeling.,Surprise
Why were the prophets so dead set against mediumship?,Surprise
"In the battle of wills, as well as the battle of resources, the Soviet Union has cards to play.",Joy
The share price should go through the roof.,Anticipation
"My head roared with neon pins and needles, at once visual and sensual.",Surprise
"Louis was reconstituting the royal family, keeping his adult sons on tenterhooks.",Anticipation
"McAllister turned off the gas ring, blew out the match, and walked to the front door, grumbling to herself, hold your horses, I'm coming, I'm coming, when another urgent series of knocks sounded.",Anticipation
I've kept myself fit and I was raring to go.,Anticipation
Pleased as Punch she is.,Joy
He was still on tenterhooks waiting for his directors' decision about the manager's job.,Anticipation
"Perfect for the postparty come-down spliff up, chill out and get One Dove on them gramophones.",Joy
I said I was only pulling your leg.,Joy
"This brought forth the usual gales of laughter and requests to pull the other one, stop having them on, etc.",Joy
You'll have to take it easy when you do come out.,Trust
They just want to stay on cloud nine.,Joy
He was grinning from ear to ear and the first stabs of doubt needled at Ruth's heart.,Joy
They are both over the moon.,Joy
Gould was in seventh heaven.,Joy
"Oh, yes, absolutely, thrilled to bits.",Joy
"If attending a wedding or party of close friends, you should have the time of your life",Anticipation
Everything becomes so much easier and some people have an experience akin to walking on air or walking on the moon.,Joy
"It could take some trial and error to discover the correct interval, and you may need to chart the person's pattern.",Joy
You mean it's all right to sleep with you under your own roof with your mother there although it's not quite the done thing here.,Surprise
Again there is nothing catch 22 about this.,Trust
The walls seem to meet overhead to block out the sky and a chill wind blows as we approach the impasse at the head of the gully.,Anticipation
All those vital issues are to be rigidly centralised and that is the crux of the matter.,Anticipation
As a last resort you can call out the total number of those present.,Anticipation
"Isn't it easier to pass the buck to your boss, some staff person or a committee?",Anticipation
"In spite of recent emotional dramas or conflicts, you must put on a brave face and allow others to share your load.",Surprise
Defence cuts could also be a stumbling block.,Anticipation
You come out of a tight spot smelling of roses.,Surprise
We ran towards our target -- King Kong's massive back -- without a hitch and I reached it just ahead of my friend.,Joy
"A natural tendency in times of recession is to batten down the hatches and look after our own needs, but as we sold raffle tickets in aid of our livestock projects in Uganda, people at the Royal certainly supported our scheme with cheerful generosity.",Joy
"Phew, that was a close shave.",Surprise
Look before you leap.,Anticipation
But it's very reassuring to know I am in safe hands here.,Trust
"I'd best take a look, just to be on the safe side.",Anticipation
"It is clearly impossible to anticipate every eventuality, but the guiding principle must be that if the source of difficulty does not lie in the implementation of a selected strategy and is not being assessed during the conduct of the investigation, then assistance can be given.",Anticipation
We have to make sure we don't fall flat on our faces after a great win at West Brom.,Anticipation
Perhaps the most dramatic fall from grace was the case of Hu Yaobang.,Surprise
"His parting advice to those interested in taking the challenge was keep an ear to the ground, your back to the wheel and get your foot in the door.",Anticipation
I've been out of the picture so long that I just want people to know what I'm about.,Anticipation
"If rags to riches is still the American dream, William Casey lived his own version of it.",Joy
The Ohio bank does not leave its newcomers to sink or swim by themselves.,Trust
He sipped some from a wooden spoon and stained part of his wispy beard a bright orange.,Joy
Why should he suddenly have materialized out of the blue?,Surprise
"Theda's jaw dropped perceptibly, and she was conscious of a sliver of tender warmth slipping into her heart.",Surprise
"So startled was he by this sudden onslaught, Ryker momentarily froze, rooted to the spot",Surprise
Mr Proctor said last night that it was all water under the bridge.,Trust
Don't miss these two chances to see red deer and roe deer as they leave the cover of their reed beds in the Leighton Moss Nature Reserve.,Anticipation
"Boxing and Las Vegas, joined in very unholy matrimony, are waiting with bated breath and heavily baited betting slips for the outcome of a fight that can be almost relied upon to restore some credibility to the heavyweight division.",Anticipation
"It is this mixture of natural and mechanical sound that makes' Ecim' so absorbing, where the feeling that one half will overcome the other keeps the excitement captured here at a fever pitch.",Anticipation
Power is prepared to run through a wall; Willie O'Connor is as hard as nails and Liam Simpson takes no prisoners.,Surprise
He sounded pleased as punch for me.,Joy
The bed was comfortable and so large you had to shout sweet nothings.,Joy
I'm really on tenterhooks about the twins.,Anticipation
"And what is even more wonderful, they all think the world of each other.",Joy
"On location in Australia, he was nothing if not the life and soul of the party.",Joy
"It's all right, Robbie, I was pulling your leg.",Joy
"At that moment, and perhaps for an hour afterwards, I was on Cloud Nine.",Joy
I was over the moon.,Joy
The ciderheads were in seventh heaven.,Joy
She was thrilled to bits.,Joy
"Once the firms' merger was in place, Mr Morrison took up the thorny issue of rationalising the accountancy profession.",Anticipation
And so we all had a close shave once a term.,Joy
"Apologise for the intrusion, to be on the safe side.",Anticipation
"Again, safety in numbers saves the day for the prey species.",Joy
"Something hit me on the back of the head, here, and I went out like a light.",Surprise
He said the Government was on course for elections to the new councils in 1995.,Anticipation
"This causes onlookers to despair, and TV schedules to go up in smoke, which can't please Philip Morris, the sponsor.",Joy
Is Iran about to make a comeback?,Anticipation
"On the one hand, the England game could be make or break.",Anticipation
They felt sure that at the moment of truth in the polling booth most voters will consider their wallets.,Anticipation
Danaher's is a rags to riches story.,Joy
The Highways Department will sink or swim on the basis of everyone pulling together.,Anticipation
We had arrived from Harehills on the up and up with the booming coal industry.,Joy
"The way he gained the word that sustains the weary was not like a bolt from the blue, but through patiently listening to God morning by morning.",Trust
"How would you like to be an innocent old woman quietly doing your knitting, and then get a letter like that out of the blue?",Surprise
Sybil's jaw dropped.,Surprise
"Lo and behold, the thief was caught red-handed.",Joy
Obviously Kaplan's recording will raise eyebrows.,Surprise
Baby kidnapper Caren McSweeney is so stunned by what she did that she has been struck dumb.,Surprise
But there was no love lost between the stars.,Surprise
I'm sensing warp portals opening deep down in our city.,Anticipation
"I also establish safety by showing I'm able to take a hell of a lot of flack and stress and if they go to pieces, I'll be there",Trust
"As we fail to remember our previous situation, a slow and subtle change of heart takes place.",Anticipation
It was appreciated by fans who sang 'Always Look On The Bright Side Of Life.',Joy
"Australian charged with spreading the rugby league gospel in the capital, was pleased as punch.",Joy
"Louis was reconstituting the royal family, keeping his adult sons on tenterhooks.",Anticipation
Living on cloud nine is intoxicating and precarious.,Joy
"The National Display Team came for the afternoon to show their special item , we were all over the moon.",Joy
"He was in seventh heaven, so excited.",Joy
"Looks thrilled to bits, doesn't he?",Joy
"Mountain biking is wonderful, you're on top of the world while you're pedalling and even higher when you've finished.",Joy
"There is a curious feeling of walking on air, which I have never thought as agreeable a sensation as people try to make out.",Joy
"In short, for many employees constructive dismissal claims give rise to a Catch 22.",Surprise
Or a mite more forgiving in a tight spot?,Surprise
"The performance went off without a hitch and the Vancouver Symphony Orchestra, with Dr Otto Klemperer conducting, played brilliantly.",Joy
He left them in safe hands.,Trust
There is safety in numbers folks.,Joy
"The sign outside may say Cad Mle Fate, but inside you watch your step.",Anticipation
"First, we want promotion this season and we're on course for that.",Joy
Mr Crowe emphasised the achievement was no flash in the pan but the result of continuous improvement over several years.,Joy
I am delighted that they all passed with flying colours.,Joy
This is the moment of truth for the Lions the six build-up provincial games can be forgotten.,Anticipation
"But if Mr Kohl is now riding high, East German expectations are riding higher.",Anticipation
"The last two competitors may be called upon to save the day, so always ensure that you keep at least one good finisher.",Anticipation
Not since the surprise smash hit of the year cast a rosy glow over Shore's vehicle.,Anticipation
Signor Candiano's letter had come out of the blue.,Surprise
We were all struck dumb for the moment.,Joy
Alexander found himself at odds with these famous words of Shakespeare.,Joy
"Well, you'll have all the time you need to be beautiful this summer and that's what summer is about, for crying out loud.",Anticipation
"Because it's a beta version, I don't propose to harp on about any niggles.",Trust
"I pretended not to notice it, and, as the students listened with bated breath, instructed them to turn to page thirty in Jespersen.",Anticipation
"But, deep down, every Russian knows that our strength is in our unity.",Trust
They fell head over heels in love and my real Mother returned.,Joy
"He was a strong, healthy lad and as pleased as punch to be working with Dad.",Joy
Eva was over the moon.,Joy
My good friends of masher persuasion are in seventh heaven when they have the opportunity of admiring eight pretty faces.,Joy
"Going Live host Phillip, 30, popped the question yesterday and was' thrilled to bits' when 28-year-old Stephanie said yes.",Joy
Of course that's not all there is to this beautiful island.,Joy
"We were trying to diverse the music with the mixture of soul and reggae, though it wasn't really the done thing at that point.",Anticipation
Kenny Schaefer aims to gatecrash the world's top ten by beating York's Commonwealth supermiddleweight champion Henry Wharton on Thursday.,Anticipation
"It means that when pesticides are used, and it is only as a last resort, then the most environmentally friendly are chosen.",Anticipation
"When the future seems to be filled with storm clouds, it may appear that the Church has no other recourse but to batten down the hatches and attempt to ride the storm.",Anticipation
I was determined to take a calculated risk.,Anticipation
"This is another high scoring technique, though its use is fraught with danger.",Anticipation
"Take cover, here comes Attila.",Anticipation
"Now watch your step, the path gets a bit steep further down.",Anticipation
England swept aside defending champions Ireland at Hoylake yesterday to stay on course for their first men's amateur Home International title for four years.,Joy
I had a trial pouring and the teapot passed with flying colours.,Joy
"If he can't make a go of them, nobody can.",Trust
Australia made inroads into our batting and the moment of truth arrived when Fletch had to go out and bat.,Anticipation
"What God has done fades slowly out of the picture, and we focus increasingly on what we ourselves seem well able to do.",Anticipation
Central bankers are riding high.,Joy
It may not be the London Palladium but it is a smash hit.,Joy
A bolt from the blue is how Dounreay described hearing of her thrilling news that she had been awarded the MBE in The Queen's birthday honours.,Surprise
"Then out of the blue, the radio station sacked them.",Surprise
Virginia's jaw dropped open in surprise.,Surprise
"Fabia was staring at him, struck dumb, when suddenly he let go one of her arms and placed an arm about her shoulders.",Surprise
Rumours about a split in the Smiths camp again reached fever pitch.,Anticipation
"I was taken aback, but deep down I wasn't totally surprised.",Surprise
It's a challenge all the more remarkable for the fact that not so long ago jetting off on holiday made her weak at the knees.,Surprise
She was over the moon with it.,Joy
Vicky is thrilled to bits that the dog has been found.,Joy
I was on top of the world.,Joy
Many centuries of trial and error would elapse before Ireland's dark secret would be revealed.,Surprise
It was a close shave.,Surprise
"Apart from the administrative and cost difficulties, linking nurses pay to performance is fraught with danger, says Mr Thompson.",Anticipation
Millie the cat is back in safe hands.,Joy
April 1992 saw the car completed and it passed its MOT with flying colours.,Joy
By this stage Labour should have been riding high.,Anticipation
"Well, there was a time when it was a bolt from the blue, I mean I've known for a week or two, but we were delighted to receive it.",Joy
"But before I had finished this wearisome task, the cheque arrived out of the blue.",Surprise
"An American is standing in an Oxford quadrangle, jaw dropped.",Surprise
"Suddenly, lo and behold, what should they see but the tiger and the jackal coming toward them with their tails tied together.",Surprise
But in the next move tit for tat retaliates.,Anticipation
"In 1987, when I was chosen to fight my first election at Birmingham's Perry Barr, I was on cloud nine, even though it was a safe Labour seat.",Joy
